{
  "tool_name": "owner_approval_policy_update",
  "job_to_be_done": "Run the Siglume first-party operation `owner.approval_policy.update` for an owned agent.",
  "summary_for_model": "Wraps the built-in Siglume owner operation `owner.approval_policy.update` and returns the structured platform response.",
  "trigger_conditions": [
    "owner explicitly asks to update the owner approval policy",
    "agent needs to run the first-party operation owner.approval_policy.update instead of calling an external API",
    "request matches the owner-governance workflow described as owner approval_policy update"
  ],
  "do_not_use_when": [
    "the owner has not reviewed the preview or has not approved the requested first-party platform change",
    "the request is unrelated to the documented owner operation or targets the wrong owned agent"
  ],
  "permission_class": "action",
  "dry_run_supported": true,
  "requires_connected_accounts": [],
  "input_schema": {
    "type": "object",
    "properties": {
      "agent_id": {
        "type": "string",
        "description": "Owned agent to target. Defaults to the agent used during template generation.",
        "default": "agt_owner_demo"
      },
      "auto_approve_below": {
        "type": "object",
        "description": "Currency-to-threshold map for auto-approved actions in minor units.",
        "default": {
          "JPY": 3000
        },
        "additionalProperties": {
          "type": "integer"
        }
      },
      "always_require_approval_for": {
        "type": "array",
        "description": "Scopes that should always require approval.",
        "items": {
          "type": "string"
        },
        "default": [
          "travel.booking"
        ]
      },
      "deny_if": {
        "type": "object",
        "description": "Risk filters that should deny execution.",
        "default": {}
      },
      "approval_ttl_minutes": {
        "type": "integer",
        "description": "Approval request time-to-live in minutes.",
        "default": 720
      },
      "structured_only": {
        "type": "boolean",
        "description": "Require machine-structured action requests before approval.",
        "default": true
      },
      "merchant_allowlist": {
        "type": "array",
        "items": {
          "type": "string"
        },
        "default": []
      },
      "merchant_denylist": {
        "type": "array",
        "items": {
          "type": "string"
        },
        "default": []
      },
      "category_allowlist": {
        "type": "array",
        "items": {
          "type": "string"
        },
        "default": []
      },
      "category_denylist": {
        "type": "array",
        "items": {
          "type": "string"
        },
        "default": []
      },
      "risk_policy": {
        "type": "object",
        "description": "Structured risk-policy payload.",
        "default": {}
      }
    },
    "required": [
      "auto_approve_below"
    ],
    "additionalProperties": false
  },
  "output_schema": {
    "type": "object",
    "properties": {
      "summary": {
        "type": "string",
        "description": "One-line summary of the first-party operation result."
      },
      "action": {
        "type": "string",
        "description": "Structured action label returned by Siglume."
      },
      "result": {
        "type": "object",
        "description": "Raw first-party operation payload returned by Siglume."
      }
    },
    "required": [
      "summary",
      "action",
      "result"
    ],
    "additionalProperties": false
  },
  "usage_hints": [
    "Use dry_run first so the owner can review the owner.approval_policy.update preview before any live execution."
  ],
  "result_hints": [
    "Lead with the summary and action, then include the structured result payload for follow-up tooling."
  ],
  "error_hints": [
    "If the operation rejects the payload, surface which input field needs correction before retrying."
  ],
  "approval_summary_template": "Run owner.approval_policy.update for {agent_id}.",
  "preview_schema": {
    "type": "object",
    "properties": {
      "summary": {
        "type": "string",
        "description": "Preview of the first-party operation."
      },
      "operation_key": {
        "type": "string",
        "description": "Owner operation that would run."
      },
      "agent_id": {
        "type": "string",
        "description": "Owned agent that would receive the operation."
      },
      "params": {
        "type": "object",
        "description": "Operation params after agent_id is removed from input."
      }
    },
    "required": [
      "summary",
      "operation_key",
      "agent_id",
      "params"
    ],
    "additionalProperties": false
  },
  "idempotency_support": true,
  "side_effect_summary": "Runs the first-party owner operation `owner.approval_policy.update` against the selected owned agent.",
  "jurisdiction": "US"
}